{
  "artifact_type": "congruent_shape_pylon_catalog",
  "as_of": "2026-08-01",
  "doctrine": {
    "admission_rule": "A pylon is admitted only when the same causal transaction appears in at least two distinct ecosystem categories, names its authority boundary, identifies its forbidden collapse, and yields a concrete proof transaction.",
    "control_question": "Which causal structures recur across otherwise unrelated compute ecosystems, and what invariant surface should ahead-rev-sim preserve so every implementation can be consumed as a replaceable commodity?",
    "shape_definition": "A congruent shape is a scale-independent causal structure, rather than a visual resemblance or shared vocabulary. It identifies where agency, state, authority, evidence, and cost move through a system.",
    "statement": "The pylon catalog converts recurring ecosystem structures into design constraints. A pylon guides interfaces, receipts, tests, and succession without granting any witness project architectural authority."
  },
  "minimum_domain_pylons_per_record": 2,
  "minimum_foundation_pylons_per_record": 4,
  "pylons": [
    {
      "authority_location": "The accepted-work contract and hidden verifier remain outside every worker, provider, device, facility, and compiler.",
      "category_ids": [],
      "design_consequences": [
        "Freeze the starting state and task identity before execution.",
        "Represent each candidate as a bounded transition rather than mutable ambient state.",
        "Seal candidate output, verifier result, replay material, and first divergence together.",
        "Compare implementations only after replaying from the same frozen base."
      ],
      "design_plane": "custody",
      "failure_modes": [
        "mutable starting state",
        "provider-defined success",
        "unreplayable candidate transition",
        "comparison after denominator drift"
      ],
      "forbidden_collapse": "Do not collapse execution completion into accepted work, or a provider response into repository state.",
      "invariant": "Frozen base plus bounded task packet plus replaceable worker produces a candidate transition that is verified, receipted, replayed, and compared outside the worker.",
      "matched_gap_ids": [
        "workload_identity",
        "accepted_result",
        "independent_validation",
        "measurement_reproducibility"
      ],
      "minimum_gap_matches": 0,
      "name": "Bounded transition spine",
      "pylon_class": "foundation",
      "pylon_id": "bounded-transition-spine",
      "proof_transaction": "Replay one candidate from a frozen base, reproduce the accepted result and receipt, then identify the first divergence after intentional tampering.",
      "required_surfaces": [
        "frozen base identity",
        "bounded task packet",
        "candidate transition artifact",
        "hidden deterministic verifier",
        "immutable receipt",
        "replay and comparison report"
      ],
      "scale_domains": [
        "instruction",
        "workload",
        "device",
        "facility",
        "ecosystem"
      ],
      "shape_notation": "frozen base + bounded packet + replaceable worker -> candidate delta -> verifier -> receipt -> replay -> comparison",
      "upstream_pylon_ids": [],
      "witness_record_ids": [
        "mlcommons-mlcflow",
        "openebl-photonics",
        "ebrains-brainscales2",
        "riscv-verification-stack"
      ]
    },
    {
      "authority_location": "The programme owns workload identity, acceptance, fallback, evidence, publication, and succession. The provider owns only its declared implementation surface.",
      "category_ids": [],
      "design_consequences": [
        "Keep acceptance and publication APIs inaccessible to providers.",
        "Require provider replacement without changing workload or receipts.",
        "Represent offers, submissions, acknowledgements, and qualification as distinct states.",
        "Treat public announcements as intake signals rather than implementation evidence."
      ],
      "design_plane": "authority",
      "failure_modes": [
        "provider self-certification",
        "endorsement laundering",
        "vendor-defined denominator",
        "fallback controlled by the accelerated implementation"
      ],
      "forbidden_collapse": "Do not merge the actor performing work with the authority accepting, publishing, or preserving it.",
      "invariant": "Execution authority is narrower than acceptance authority, and both remain narrower than architectural and historical custody.",
      "matched_gap_ids": [
        "accepted_result",
        "workload_identity",
        "software_fallback",
        "independent_validation",
        "governance_durability"
      ],
      "minimum_gap_matches": 0,
      "name": "Authority outside provider",
      "pylon_class": "foundation",
      "pylon_id": "authority-outside-provider",
      "proof_transaction": "Replace a named provider with a reference implementation while preserving the accepted result, refusal behavior, fallback, evidence boundary, and historical receipt chain.",
      "required_surfaces": [
        "provider manifest",
        "acceptance contract",
        "fallback contract",
        "publication boundary",
        "substitution test"
      ],
      "scale_domains": [
        "worker",
        "device",
        "vendor",
        "facility",
        "programme"
      ],
      "shape_notation": "provider executes inside declared surface; acceptance, fallback, evidence, and publication remain outside",
      "upstream_pylon_ids": [
        "bounded-transition-spine"
      ],
      "witness_record_ids": [
        "ahead-high-performance-riscv",
        "vaire-arc-evp",
        "aria-scaling-inference-lab",
        "smart-usa-terminated"
      ]
    },
    {
      "authority_location": "The verifier and receipt layer define refusal, fault, absence, uncertainty, and unresolved boundaries before any positive claim is admitted.",
      "category_ids": [],
      "design_consequences": [
        "Give refused, faulted, missing, and not-applicable outcomes stable identities.",
        "Retain blockers in the same artifact as successful observations.",
        "Require ambiguous command or evidence states to fail closed.",
        "Use missing evidence to generate the next transaction rather than prose optimism."
      ],
      "design_plane": "failure",
      "failure_modes": [
        "silent omission",
        "best-effort acceptance",
        "ambiguous terminal state",
        "absence represented as zero"
      ],
      "forbidden_collapse": "Do not collapse missing, refused, faulted, unmeasured, simulated, and accepted states into one boolean success field.",
      "invariant": "Negative space is executable evidence. The system must preserve why a claim was refused and what transaction would remove the blocker.",
      "matched_gap_ids": [
        "accepted_result",
        "reliability_endurance",
        "governance_durability",
        "independent_validation"
      ],
      "minimum_gap_matches": 0,
      "name": "Negative-space refusal ledger",
      "pylon_class": "foundation",
      "pylon_id": "negative-space-refusal-ledger",
      "proof_transaction": "Submit ambiguous, incomplete, stale, and faulting fixtures and prove that each produces a distinct terminal receipt without mutating accepted state.",
      "required_surfaces": [
        "terminal-state taxonomy",
        "blocker codes",
        "first-divergence evidence",
        "next-transaction field"
      ],
      "scale_domains": [
        "command",
        "workload",
        "measurement",
        "fabrication run",
        "programme"
      ],
      "shape_notation": "candidate -> accepted | refused | faulted | unmeasured, each with immutable blockers and next transaction",
      "upstream_pylon_ids": [
        "bounded-transition-spine",
        "authority-outside-provider"
      ],
      "witness_record_ids": [
        "smart-usa-terminated",
        "riscv-verification-stack",
        "protean-shepherd-nova",
        "ucie-3"
      ]
    },
    {
      "authority_location": "The estate retains the source-to-build-to-execution-to-measurement-to-supersession chain independently of any current maintainer or facility.",
      "category_ids": [],
      "design_consequences": [
        "Hash every authority-changing artifact and transformation.",
        "Bind source, tool, model, PDK, firmware, calibration, execution, and measurement identities.",
        "Record supersession without deleting prior accepted evidence.",
        "Require artifact-only reconstruction by an external acceptor."
      ],
      "design_plane": "provenance",
      "failure_modes": [
        "orphaned binary",
        "unversioned model or PDK",
        "maintainer disappearance",
        "history rewritten by latest release"
      ],
      "forbidden_collapse": "Do not replace historical custody with a link to the current vendor, branch, facility, or documentation page.",
      "invariant": "Every accepted transition remains reconstructable after its original actor, tool, facility, or programme disappears.",
      "matched_gap_ids": [
        "governance_durability",
        "workload_identity",
        "security_isolation",
        "independent_validation",
        "access_licensing"
      ],
      "minimum_gap_matches": 0,
      "name": "Provenance and succession chain",
      "pylon_class": "foundation",
      "pylon_id": "provenance-succession-chain",
      "proof_transaction": "Reconstruct one accepted result from pinned artifacts after removing the original builder, network service, and current documentation from the path.",
      "required_surfaces": [
        "source identity",
        "transformation attestations",
        "artifact manifest",
        "measurement provenance",
        "supersession chain"
      ],
      "scale_domains": [
        "source file",